Messages,1105_1028msg
1105_1028_1,Hey var_firstname Would you {want|like} to earn {645|578|322} every time you use your internet? For additional {information|info} go to www.discoverturboinc.com today
1105_1028_2,Hey var_firstname start earning {209|282|89} every time you turn on your {computer|mobile} For more {information|info} go to www.discoverturboinc.com asap
1105_1028_3,"Hi var_firstname work at home and make an extra {322|203|146} per {day|week}, Start todayby going to www.hammerclockwise.com for free"
1105_1028_4,Hi var_firstname Would you like to earn {253|660|333} {each|every} time you use your computer?l For {additional|more} info you can visit www.hammerclockwise.com for free today
1105_1028_5,var_firstname Could you use an extra {413|358|165} each {week|day} just using ur internet. {For|Get} {additional|more} info by clickng here for free today: www.oneshotconsultingllc.com
1105_1028_6,var_firstname start {earning|making} {380|234|419} every time you turn on your phone. For additional {information|info} go to www.oneshotconsultingllc.com right now.
1105_1028_7,"Hi var_firstname work at home and make an extra {202|403|46} per {day|week}, start today. {For|Get} more info by clicking here: www.adamslogisticsgroup.com"
1105_1028_8,Hello var_firstname Would you like to {earn|make} {214|399|324} every time you use your cellphone? For {additional|extra} info visit us at www.adamslogisticsgroup.com
1105_1028_9,Hi var_firstname Would you like to earn {253|660|333} {each|every} time you use your internet?  For {additional|more} info go to www.beancounterlegends.com today.
1105_1028_10,Hey var_firstname Would you {want|like} to earn {380|280|213} every time you use your cell {Get|For} more info click here for free www.beancounterlegends.com
1105_1028_11,Hello var_firstname Would you like to {earn|make} {653|21|361} every time you use your phone? For more {information|info} click here for free: www.skylinetechnic.com
1105_1028_12,Hi var_firstname {begin|start} earning {348|275|532} every time you turn on your phone {Get|For} {added|more} info visit www.skylinetechnic.com for free today.
1105_1028_13,Hi var_firstname you can {make|earn} an extra {664|535|146} using your mobile. For {more|additional} infoclick here for free www.skylinetechnic.com
1105_1028_14,Hi var_firstname start earning {241|251|321} every time you turn on your {phone|cell} For {more|additional} info you can visit for free: www.skylinetechnic.com
1105_1028_15,"var_firstname work at home and make an extra {845|756|650} per week,{Start|Begin} today by going to www.bigrockoindustries.com ,and it's for free."
1105_1028_16,Hey var_firstname start {earning|making} {394|133|77} every time you turn on your phone {For|Get} more info at www.bigrockoindustries.com today for free.
1105_1028_17,var_firstname Would you like to earn {487|135|294} {each|every} time you use your cell For {bonus|extra} {information|Info} visit us at www.bigrockoindustries.com
1105_1028_18,var_firstname you can make an extra {546|471|475} using your {mobile|cell} phone. For {More|Additional} info click here for free: www.careercentertrg.com
1105_1028_19,var_firstname Could you use an extra {542|484|26} each {week|day} just by working from home? For {Additional|More} {Info|information} visit www.careercentertrg.com
1105_1028_20,Hi var_firstname Would you like to {earn|make} {70|235|603} every time you use your cell {For|Get} {More|Extra} info txt at www.careercentertrg.com for free
1105_1028_21,var_firstname Could you use an extra {532|386|150} each {week|day} just using ur cell For {Additional|More} {Info|information}visit us at www.careercentertrg.com
1105_1028_22,Hi var_firstname start earning {450|44|550} every time you turn on your {phone|cell} {Get|For} {Additional|More} info go to www.grandeprovidenceinc.com
1105_1028_23,var_firstname start earning {558|284|308} every time you turn on your {phone|mobile} {Get|For} {more|extra} info visit us at www.grandeprovidenceinc.com
1105_1028_24,Hello var_firstname Would you like to earn {234|592|383} {each|every} time you use your computer? {For|Get} {additional|more} info visit www.empireskylimit.com
1105_1028_25,Hi var_firstname start earning {44|38|639} {every|each} time you turn on your phone {For|Get} more info go to www.empireskylimit.com for free today.
