1210_1,Hi var_firstname Hope you didn't miss our {m3ssag3|t3xt} about the improved {guid3|syst3m} to us3. S33 h3r3 for fr33 www.managementplacement.com
1210_2,"var_firstname ,y0u still {can|will} use this simple guide t0 help y0u. {G0|Click} here t0day t0 {see|view} f0r free www.trainingresourcesgpc.com"
1210_3,"Hello var_firstname y0u still have 0ne pending message in the acc0unt, h0pe you didn't it. View {free|t0day|n0w} www.quickeasycourses.com"
1210_4,"var_firstname ,y0u have a reminder ab0ut an unread message, Click here t0 {g0 n0w|view} www.socialtrainingtoday.com"
1210_5,"Hi,this is a notice for your message, var_firstname ,that you might have missed,see it now at www.managementplacement.com"
1210_6,var_firstname y0u {can|will} use this simple guide that 0ther pe0ple have used 0nline. {G0|Click} here to {see|view} for free www.membervipglobal.com
1210_7,"var_firstname ,there is 0ne unread message in y0ur account, view today before it expires. Open to read at www.homebasedkits.com"
1210_8,"Hello var_firstname  0ne missed message sitting in y0ur acc0unt, expires in a c0uple of days, view n0w at www.quickthanksdelivery.com"
1210_9,"Hey var_firstname beg1n read1ng ur messages 1n your 1nbox today, you can cl1ck here www.packetenotices.com before exp1ration."
1210_10,Hi var_firstname please d0n't miss 0ut on the update in your account. View her3 today for fr33: www.trainingresourcesgpc.com
1210_11,var_firstname we h0pe you didn't miss us1ng this {guide|system} that works like clockwork. Click here to explor3 @ www.elitestarts.com
1210_12,"var_firstname, you {c@n|will} generate up to hundreds a d@y. {Go|Click} here to {see|view} for free today @ www.homebasedkits.com"
1210_13,"Hello var_firstname you have 0ne pending message, hope you didn't miss the n0tice sent. View {free|t0day} www.membervipglobal.com"
1210_14,"This is a reminder 4 var_firstname about a msg in y0ur acc0unt, Click here to {s33|view} @ www.genesisnewmember.com"
1210_15,"var_firstname ,a {simple|qu1ck} notice 4 your message that you might have missed, read it today @ www.quickthanksdelivery.com"
1210_16,var_firstname check it out today h0w u {can|will} use this guid3 that can make {1oo|2oo|3oo} /day. {Go|Click} here www.elitestarts.com
1210_17,"var_firstname ,you h@ve on3 unread message in your inbox, view today so you don't miss out. See at www.socialtrainingtoday.com"
1210_18,"var_firstname  A missed message sitting in y0ur acc0unt, pls view before expiry t0day, click now @  www.elitestarts.com"
1210_19,"Hey var_firstname b3gin vi3wing your m3ssag3s in your inbox today befor3 3xpiration, you can click h3r3 www.managementplacement.com"
1210_20,"Hi var_firstname s33 this guid3 sitting in your account, hurry, 3xpiring soon so don't miss out! Vi3w h3r3: www.quickeasycourses.com"
1210_21,var_firstname we hope you didn't miss what other {people|members} are doing using this {guide|system}.Click at www.genesisnewmember.com
1210_22,"var_firstname, {can|will} y0u be able to  generate up to {1o5|2o3|3o3} /day? {Go|Click} here to {see|view} h0w p0ssible it is www.quickthanksdelivery.com"
1210_23,"Hell0 var_firstname y0u have 1 unread message, h0pe y0u d0n't miss it. View {free|t0day} @ www.packetenotices.com"
1210_24,"Hi var_firstname you have 1 unread message pending, Click here 2 {see|view} www.trainingresourcesgpc.com"
1210_25,"This is a friendly notice for a msg that you missed, you can read it today @ www.membervipglobal.com"
1210_26,var_firstname y0u have a msg sitting in y0ur acc0unt. {Go|Click} h3r3 to {s33|vi3w} www.socialtrainingtoday.com
1210_27,"This is a reminder 4 var_firstname about a msg in y0ur acc0unt, Click here to {s33|view} @ www.homebasedkits.com"
1210_28,"var_firstname ,a {simple|qu1ck} notice 4 your message that you might have missed, read it today @ www.quickeasycourses.com"
1210_29,Hi var_firstname please d0n't miss 0ut on the update in your account. View her3 today for fr33: www.packetenotices.com
1210_30,var_firstname we h0pe you didn't miss us1ng this {guide|system} that works like clockwork. Click here to explor3 @ www.genesisnewmember.com
